id,app_id,author,title,content,rating,date
13055383194,324684580,mely35,Lo mejor,Excelente,5,2025-08-24T09:14:17-07:00
13055321019,324684580,klozano123,Seamless user friendly music app,I have used Spotify for a while and I love that it connects easily with Amazon echo and with any smart TV. I genuinely enjoy searching music through this app.,5,2025-08-24T08:55:52-07:00
13055266933,324684580,Ezio auditory de Ferenczi,It’s saying it offline for some reason when it shouldn’t,Spotify I’ve been using this for years and have tried everything but it’s telling me that it’s offline and won’t come back online my internet is fine Ive tried redownloading turn my phone off and everything else but nothing is working please fux this,5,2025-08-24T08:39:56-07:00
13055235703,324684580,Rafanh745,Fire but crazy expensive,The music and everything about the app is amazing but 12 a month is too much,4,2025-08-24T08:30:54-07:00
13055206038,324684580,really love kittys,Song,When I search up a song and click it it’s usually never the song I wanted to listen to,4,2025-08-24T08:22:16-07:00
13055199698,324684580,TJ J Marshall,Great,Enjoying my personal selection! Ad’s don’t bother me 10/10,5,2025-08-24T08:20:28-07:00
13055197631,324684580,anaq94,Spotify,I love this app so much it might not put the music in the right way but it’s way better then pandora and the best music app ever❤️❤️❤️,5,2025-08-24T08:19:53-07:00
13055195529,324684580,Wings n words,Fingertip to soul,"I love Spotify’s quick reach to my heart and soul.  My idea or thought of a piece of music or an artist to Spotify search with my fingertips, there is the quick sound that reaches past my busy thinking to my heart or soul.  How groovy is that?",5,2025-08-24T08:19:17-07:00
13055177891,324684580,ParadoxicallyThinking,Great streaming service with some flaws.,"I love Spotify, I’ve used it for years. It’s most known for being free so long as you’re okay with missing out on some features, and having to deal with ads. It is objectively better than Apple Music mostly because you are given much more freedom and control over your playback, such as; Crossfade, Customizable EQ, full control over volume levels, full control over audio quality on both cellular and wifi connections, and more recently custom mixing where you can specialize specific songs with their own exclusive EQ and details, whether than having every song you listen to be locked to one setting. My biggest issue with this app is how easy it is to accidentally swipe and skip a song. I find myself constantly accidentally switching between songs when trying to swipe down to get the media player out of the way. Despite its few flaw, Spotify has always been a staple brand for anyone looking to simply stream music, as long as you aren’t really nerdy, -like me- and you don’t care about statistics like audio quality, or EQ stuff, this app will be great for you. But even if you do care about the nerdy stuff I’d still recommend it. Mostly because you aren’t going to find another one that gives you as much freedom as Spotify does. So it essentially comes down to what you’re looking for in a streaming platform.",5,2025-08-24T08:14:14-07:00
13055155518,324684580,(;)(6,it’s good !,it’s awesome it’s just the ads. they pmo.,4,2025-08-24T08:07:48-07:00
13055129058,324684580,chrebre,My Favorite podcast,"Club Bubble is awesome !
Love hearing the guests / childrens guessing answers & host is wonderful with them !!",5,2025-08-24T08:00:15-07:00
13055120732,324684580,Duke.VB,Cool,The best,5,2025-08-24T07:57:52-07:00
13055120314,324684580,MetallicMetaI,Honestly app is okish but unfair but I guess others aren’t having these “problems”,"I try to listen to my playlist and it throws in some suggested songs like I don’t need those there and then this doesn’t happen on android, on android I can choose any song from my playlist and it will play and it plays in order and it even shuffles when I click shuffle (I don’t have premium) and on iOS it shuffles SINGULAR songs and I have to skip to the song I had searched up and I can’t even choose, shuffle nor listen to a normal playlist like if your gonna make an apple at least make it equal to all devices. 😔",2,2025-08-24T07:57:45-07:00
13055108446,324684580,Razul Islam,Wanting,Free version with at least 10 song download ability is a request. Please consider. Take love from Bangladesh <3,4,2025-08-24T07:54:21-07:00
